{
  "schema_version": "1.0.0",
  "source": "xpack",
  "_pending_verification": true,
  "_notes": "URLs sourced from https://github.com/xpack-dev-tools/<tool>-xpack/releases.  SHA256 fields are zero-padded placeholders — run scripts/refresh_source_pins.py --apply to populate from upstream release feeds before a public release.",
  "tools": [
    {
      "tool": "arm-none-eabi-gcc",
      "version": "14.2.1-1.1",
      "hosts": {
        "linux-x86_64": {
          "url": "https://github.com/xpack-dev-tools/arm-none-eabi-gcc-xpack/releases/download/v14.2.1-1.1/xpack-arm-none-eabi-gcc-14.2.1-1.1-linux-x64.tar.gz",
          "sha256": "0000000000000000000000000000000000000000000000000000000000000000",
          "archive_kind": "tar.gz",
          "extract_to_subdir": "xpack-arm-none-eabi-gcc-14.2.1-1.1",
          "binaries": [
            "bin/arm-none-eabi-gcc",
            "bin/arm-none-eabi-g++",
            "bin/arm-none-eabi-gdb",
            "bin/arm-none-eabi-size",
            "bin/arm-none-eabi-objcopy",
            "bin/arm-none-eabi-objdump",
            "bin/arm-none-eabi-ar",
            "bin/arm-none-eabi-ranlib",
            "bin/arm-none-eabi-ld"
          ]
        },
        "linux-arm64": {
          "url": "https://github.com/xpack-dev-tools/arm-none-eabi-gcc-xpack/releases/download/v14.2.1-1.1/xpack-arm-none-eabi-gcc-14.2.1-1.1-linux-arm64.tar.gz",
          "sha256": "0000000000000000000000000000000000000000000000000000000000000000",
          "archive_kind": "tar.gz",
          "extract_to_subdir": "xpack-arm-none-eabi-gcc-14.2.1-1.1",
          "binaries": [
            "bin/arm-none-eabi-gcc",
            "bin/arm-none-eabi-g++",
            "bin/arm-none-eabi-gdb",
            "bin/arm-none-eabi-size",
            "bin/arm-none-eabi-objcopy",
            "bin/arm-none-eabi-objdump",
            "bin/arm-none-eabi-ar",
            "bin/arm-none-eabi-ranlib",
            "bin/arm-none-eabi-ld"
          ]
        },
        "macos-x86_64": {
          "url": "https://github.com/xpack-dev-tools/arm-none-eabi-gcc-xpack/releases/download/v14.2.1-1.1/xpack-arm-none-eabi-gcc-14.2.1-1.1-darwin-x64.tar.gz",
          "sha256": "0000000000000000000000000000000000000000000000000000000000000000",
          "archive_kind": "tar.gz",
          "extract_to_subdir": "xpack-arm-none-eabi-gcc-14.2.1-1.1",
          "binaries": [
            "bin/arm-none-eabi-gcc",
            "bin/arm-none-eabi-g++",
            "bin/arm-none-eabi-gdb",
            "bin/arm-none-eabi-size",
            "bin/arm-none-eabi-objcopy",
            "bin/arm-none-eabi-objdump",
            "bin/arm-none-eabi-ar",
            "bin/arm-none-eabi-ranlib",
            "bin/arm-none-eabi-ld"
          ]
        },
        "macos-arm64": {
          "url": "https://github.com/xpack-dev-tools/arm-none-eabi-gcc-xpack/releases/download/v14.2.1-1.1/xpack-arm-none-eabi-gcc-14.2.1-1.1-darwin-arm64.tar.gz",
          "sha256": "0000000000000000000000000000000000000000000000000000000000000000",
          "archive_kind": "tar.gz",
          "extract_to_subdir": "xpack-arm-none-eabi-gcc-14.2.1-1.1",
          "binaries": [
            "bin/arm-none-eabi-gcc",
            "bin/arm-none-eabi-g++",
            "bin/arm-none-eabi-gdb",
            "bin/arm-none-eabi-size",
            "bin/arm-none-eabi-objcopy",
            "bin/arm-none-eabi-objdump",
            "bin/arm-none-eabi-ar",
            "bin/arm-none-eabi-ranlib",
            "bin/arm-none-eabi-ld"
          ]
        },
        "windows-x86_64": {
          "url": "https://github.com/xpack-dev-tools/arm-none-eabi-gcc-xpack/releases/download/v14.2.1-1.1/xpack-arm-none-eabi-gcc-14.2.1-1.1-win32-x64.zip",
          "sha256": "0000000000000000000000000000000000000000000000000000000000000000",
          "archive_kind": "zip",
          "extract_to_subdir": "xpack-arm-none-eabi-gcc-14.2.1-1.1",
          "binaries": [
            "bin/arm-none-eabi-gcc.exe",
            "bin/arm-none-eabi-g++.exe",
            "bin/arm-none-eabi-gdb.exe",
            "bin/arm-none-eabi-size.exe",
            "bin/arm-none-eabi-objcopy.exe",
            "bin/arm-none-eabi-objdump.exe",
            "bin/arm-none-eabi-ar.exe",
            "bin/arm-none-eabi-ranlib.exe",
            "bin/arm-none-eabi-ld.exe"
          ]
        }
      }
    },
    {
      "tool": "cmake",
      "version": "3.31.2-1.1",
      "hosts": {
        "linux-x86_64": {
          "url": "https://github.com/xpack-dev-tools/cmake-xpack/releases/download/v3.31.2-1.1/xpack-cmake-3.31.2-1.1-linux-x64.tar.gz",
          "sha256": "0000000000000000000000000000000000000000000000000000000000000000",
          "archive_kind": "tar.gz",
          "extract_to_subdir": "xpack-cmake-3.31.2-1.1",
          "binaries": ["bin/cmake", "bin/ctest", "bin/cpack"]
        },
        "linux-arm64": {
          "url": "https://github.com/xpack-dev-tools/cmake-xpack/releases/download/v3.31.2-1.1/xpack-cmake-3.31.2-1.1-linux-arm64.tar.gz",
          "sha256": "0000000000000000000000000000000000000000000000000000000000000000",
          "archive_kind": "tar.gz",
          "extract_to_subdir": "xpack-cmake-3.31.2-1.1",
          "binaries": ["bin/cmake", "bin/ctest", "bin/cpack"]
        },
        "macos-x86_64": {
          "url": "https://github.com/xpack-dev-tools/cmake-xpack/releases/download/v3.31.2-1.1/xpack-cmake-3.31.2-1.1-darwin-x64.tar.gz",
          "sha256": "0000000000000000000000000000000000000000000000000000000000000000",
          "archive_kind": "tar.gz",
          "extract_to_subdir": "xpack-cmake-3.31.2-1.1",
          "binaries": ["bin/cmake", "bin/ctest", "bin/cpack"]
        },
        "macos-arm64": {
          "url": "https://github.com/xpack-dev-tools/cmake-xpack/releases/download/v3.31.2-1.1/xpack-cmake-3.31.2-1.1-darwin-arm64.tar.gz",
          "sha256": "0000000000000000000000000000000000000000000000000000000000000000",
          "archive_kind": "tar.gz",
          "extract_to_subdir": "xpack-cmake-3.31.2-1.1",
          "binaries": ["bin/cmake", "bin/ctest", "bin/cpack"]
        },
        "windows-x86_64": {
          "url": "https://github.com/xpack-dev-tools/cmake-xpack/releases/download/v3.31.2-1.1/xpack-cmake-3.31.2-1.1-win32-x64.zip",
          "sha256": "0000000000000000000000000000000000000000000000000000000000000000",
          "archive_kind": "zip",
          "extract_to_subdir": "xpack-cmake-3.31.2-1.1",
          "binaries": ["bin/cmake.exe", "bin/ctest.exe", "bin/cpack.exe"]
        }
      }
    },
    {
      "tool": "ninja",
      "version": "1.12.1-1.1",
      "hosts": {
        "linux-x86_64": {
          "url": "https://github.com/xpack-dev-tools/ninja-build-xpack/releases/download/v1.12.1-1.1/xpack-ninja-build-1.12.1-1.1-linux-x64.tar.gz",
          "sha256": "0000000000000000000000000000000000000000000000000000000000000000",
          "archive_kind": "tar.gz",
          "extract_to_subdir": "xpack-ninja-build-1.12.1-1.1",
          "binaries": ["bin/ninja"]
        },
        "linux-arm64": {
          "url": "https://github.com/xpack-dev-tools/ninja-build-xpack/releases/download/v1.12.1-1.1/xpack-ninja-build-1.12.1-1.1-linux-arm64.tar.gz",
          "sha256": "0000000000000000000000000000000000000000000000000000000000000000",
          "archive_kind": "tar.gz",
          "extract_to_subdir": "xpack-ninja-build-1.12.1-1.1",
          "binaries": ["bin/ninja"]
        },
        "macos-x86_64": {
          "url": "https://github.com/xpack-dev-tools/ninja-build-xpack/releases/download/v1.12.1-1.1/xpack-ninja-build-1.12.1-1.1-darwin-x64.tar.gz",
          "sha256": "0000000000000000000000000000000000000000000000000000000000000000",
          "archive_kind": "tar.gz",
          "extract_to_subdir": "xpack-ninja-build-1.12.1-1.1",
          "binaries": ["bin/ninja"]
        },
        "macos-arm64": {
          "url": "https://github.com/xpack-dev-tools/ninja-build-xpack/releases/download/v1.12.1-1.1/xpack-ninja-build-1.12.1-1.1-darwin-arm64.tar.gz",
          "sha256": "0000000000000000000000000000000000000000000000000000000000000000",
          "archive_kind": "tar.gz",
          "extract_to_subdir": "xpack-ninja-build-1.12.1-1.1",
          "binaries": ["bin/ninja"]
        },
        "windows-x86_64": {
          "url": "https://github.com/xpack-dev-tools/ninja-build-xpack/releases/download/v1.12.1-1.1/xpack-ninja-build-1.12.1-1.1-win32-x64.zip",
          "sha256": "0000000000000000000000000000000000000000000000000000000000000000",
          "archive_kind": "zip",
          "extract_to_subdir": "xpack-ninja-build-1.12.1-1.1",
          "binaries": ["bin/ninja.exe"]
        }
      }
    }
  ]
}
